{
  "finding_id": "pytorch_72408",
  "repo": "pytorch/pytorch",
  "issue_number": 72408,
  "issue_title": "Matrix multiplication is 30 times slower for integers than floats on CPU",
  "issue_url": "https://github.com/pytorch/pytorch/issues/72408",
  "issue_state": "OPEN",
  "issue_created_at": "2022-02-07T04:58:18Z",
  "issue_labels": [
    "module: performance",
    "module: cpu",
    "triaged",
    "module: linear algebra"
  ],
  "body_preview": "",
  "initial_classification": "performance_regression",
  "surface_reasoning": "Priority 2: title states a concrete regression multiplier ('30 times slower') \u2014 quantified before/after performance gap, not a vague complaint. Concrete before/after performance signal satisfies P2 requirement.",
  "stage": "raw",
  "linked_prs": null,
  "maintainer_signals": null,
  "blocking_signals": null,
  "fix_scope": null,
  "affected_hardware": null,
  "still_reproducible": null,
  "confidence": null,
  "confidence_justification": null,
  "recommended_action": null,
  "closest_ground_truth": null,
  "ground_truth_delta": null,
  "created_at": "2026-04-24T00:00:00Z",
  "updated_at": "2026-04-24T00:00:00Z"
}