{
  "finding_id": "pytorch_101249",
  "repo": "pytorch/pytorch",
  "issue_number": 101249,
  "issue_title": "`einsum` is about 40x slower on CUDA than manually multiplying and summing",
  "issue_url": "https://github.com/pytorch/pytorch/issues/101249",
  "issue_state": "OPEN",
  "issue_created_at": "2023-05-12T02:59:52Z",
  "issue_labels": [
    "module: performance",
    "triaged",
    "module: linear algebra"
  ],
  "body_preview": "",
  "initial_classification": "performance_regression",
  "surface_reasoning": "Priority 2: labeled `module: performance` + `module: linear algebra`. Title: 'einsum is about 40x slower on CUDA than manually multiplying and summing' \u2014 concrete 40x regression on a CUDA compute op. Domain relevance: CUDA einsum should dispatch to optimized cuBLAS matmul/bmm paths; 40x slowdown versus manual computation indicates broken or missing CUDA kernel dispatch in the einsum optimizer.",
  "stage": "raw",
  "linked_prs": null,
  "maintainer_signals": null,
  "blocking_signals": null,
  "fix_scope": null,
  "affected_hardware": null,
  "still_reproducible": null,
  "confidence": null,
  "confidence_justification": null,
  "recommended_action": null,
  "closest_ground_truth": null,
  "ground_truth_delta": null,
  "created_at": "2026-04-24T10:00:00Z",
  "updated_at": "2026-04-24T10:00:00Z"
}