{
  "finding_id": "pytorch_88941",
  "repo": "pytorch/pytorch",
  "issue_number": 88941,
  "issue_title": "`torch.linalg.lstsq` Trigger RuntimeError under UndefinedBehaviorSanitizer",
  "issue_url": "https://github.com/pytorch/pytorch/issues/88941",
  "issue_state": "OPEN",
  "issue_created_at": "2022-11-12T16:30:33Z",
  "issue_labels": [
    "triaged",
    "module: linear algebra",
    "actionable",
    "module: sanitizers",
    "module: edge cases"
  ],
  "body_preview": "",
  "initial_classification": "unknown",
  "surface_reasoning": "Priority 4: labeled `actionable` + `module: linear algebra` + `module: sanitizers`. Open since 2022-12-09 with actionable label. Title: `torch.linalg.lstsq` triggers RuntimeError under UndefinedBehaviorSanitizer \u2014 UB in a CUDA/BLAS linear algebra routine flagged by sanitizer. Domain relevance: `lstsq` on CUDA uses LAPACK/cuSOLVER routines; UBSan errors indicate undefined behavior in the kernel dispatch or numerical computation path requiring LAPACK/CUDA expertise.",
  "stage": "raw",
  "linked_prs": null,
  "maintainer_signals": null,
  "blocking_signals": null,
  "fix_scope": null,
  "affected_hardware": null,
  "still_reproducible": null,
  "confidence": null,
  "confidence_justification": null,
  "recommended_action": null,
  "closest_ground_truth": null,
  "ground_truth_delta": null,
  "created_at": "2026-04-24T10:00:00Z",
  "updated_at": "2026-04-24T10:00:00Z"
}