{
  "finding_id": "pytorch_173110",
  "repo": "pytorch/pytorch",
  "issue_number": 173110,
  "issue_title": "`maximum()`: out-of-place returns incorrect unsigned output on type promotion.",
  "issue_url": "https://github.com/pytorch/pytorch/issues/173110",
  "issue_state": "OPEN",
  "issue_created_at": "2026-01-22T21:12:18Z",
  "issue_labels": [
    "high priority",
    "module: cuda",
    "triaged",
    "actionable",
    "module: correctness (silent)"
  ],
  "body_preview": "",
  "initial_classification": "correctness_silent",
  "surface_reasoning": "Priority 1: labeled `module: correctness (silent)` + `module: cuda` + `actionable` + `high priority`. Title: `maximum()` out-of-place returns incorrect unsigned output on type promotion \u2014 silent wrong result in a CUDA element-wise op due to dtype promotion. Domain relevance: CUDA element-wise `maximum` kernel must handle unsigned integer type promotion correctly; the bug is in the CUDA kernel's output type computation path.",
  "stage": "raw",
  "linked_prs": null,
  "maintainer_signals": null,
  "blocking_signals": null,
  "fix_scope": null,
  "affected_hardware": null,
  "still_reproducible": null,
  "confidence": null,
  "confidence_justification": null,
  "recommended_action": null,
  "closest_ground_truth": null,
  "ground_truth_delta": null,
  "created_at": "2026-04-24T10:00:00Z",
  "updated_at": "2026-04-24T10:00:00Z"
}