{
  "finding_id": "pytorch_101529",
  "repo": "pytorch/pytorch",
  "issue_number": 101529,
  "issue_title": "Inconsistent performance degradation of 3x3 convolution (torch 2.0.1+cu118)",
  "issue_url": "https://github.com/pytorch/pytorch/issues/101529",
  "issue_state": "OPEN",
  "issue_created_at": "2023-05-16T07:34:32Z",
  "issue_labels": [
    "module: performance",
    "module: cudnn",
    "module: cuda",
    "triaged",
    "module: regression"
  ],
  "body_preview": "",
  "initial_classification": "performance_regression",
  "surface_reasoning": "Priority 2: labeled `module: performance` + `module: cudnn` + `module: cuda` + `module: regression`. Title: inconsistent performance degradation of 3x3 convolution in torch 2.0.1+cu118 \u2014 regression with a specific version and hardware combination. Domain relevance: 3x3 convolution on CUDA uses cuDNN implicit GEMM kernels; performance regression in a specific version requires analysis of cuDNN algorithm selection changes.",
  "stage": "raw",
  "linked_prs": null,
  "maintainer_signals": null,
  "blocking_signals": null,
  "fix_scope": null,
  "affected_hardware": null,
  "still_reproducible": null,
  "confidence": null,
  "confidence_justification": null,
  "recommended_action": null,
  "closest_ground_truth": null,
  "ground_truth_delta": null,
  "created_at": "2026-04-24T10:00:00Z",
  "updated_at": "2026-04-24T10:00:00Z"
}