{
  "finding_id": "pytorch_136299",
  "repo": "pytorch/pytorch",
  "issue_number": 136299,
  "issue_title": "The results of baddbmm on CPU seem to have issues under certain conditions",
  "issue_url": "https://github.com/pytorch/pytorch/issues/136299",
  "issue_state": "OPEN",
  "issue_created_at": "2024-09-19T01:57:44Z",
  "issue_labels": [
    "high priority",
    "triaged",
    "module: regression",
    "module: correctness (silent)",
    "module: arm"
  ],
  "body_preview": "",
  "initial_classification": "correctness_silent",
  "surface_reasoning": "Priority 1: labeled `module: correctness (silent)` + `module: regression` + `high priority` + `module: arm`. Title: `baddbmm` on CPU has issues under certain conditions \u2014 silent wrong results in a batch GEMM op. Domain relevance: `baddbmm` dispatches to BLAS routines; correctness issues under specific conditions indicate a kernel dispatch or numeric computation bug at the BLAS level.",
  "stage": "raw",
  "linked_prs": null,
  "maintainer_signals": null,
  "blocking_signals": null,
  "fix_scope": null,
  "affected_hardware": null,
  "still_reproducible": null,
  "confidence": null,
  "confidence_justification": null,
  "recommended_action": null,
  "closest_ground_truth": null,
  "ground_truth_delta": null,
  "created_at": "2026-04-24T10:00:00Z",
  "updated_at": "2026-04-24T10:00:00Z"
}