{
  "finding_id": "pytorch_178880",
  "repo": "pytorch/pytorch",
  "issue_number": 178880,
  "issue_title": "`torch.compile` produces different classification output for model using E8M0 bit-manipulation quantization (`view(int32) → bitshift → clamp → uint8`)",
  "issue_url": "https://github.com/pytorch/pytorch/issues/178880",
  "issue_state": "OPEN",
  "issue_created_at": "2026-03-31T15:07:05Z",
  "issue_labels": [
    "high priority",
    "triaged",
    "module: correctness (silent)",
    "oncall: pt2",
    "module: inductor",
    "topic: fuzzer",
    "bot-triaged"
  ],
  "body_preview": "",
  "initial_classification": "correctness_silent",
  "surface_reasoning": "Priority 1: carries `module: correctness (silent)` label — PyTorch's explicit marker for silent wrong-answer bugs. labeled `high priority`. Maintainer `high priority` label confirms the bug is important and acknowledged.",
  "stage": "needs_review",

  "linked_prs": [],

  "maintainer_signals": [],

  "blocking_signals": [],

  "fix_scope": "unknown",

  "affected_hardware": [],

  "still_reproducible": "likely",

  "confidence": 0.65,

  "confidence_justification": "Start: 0.50. Step 1: 'module: correctness (silent)' label present (+0.25). Running total: 0.75. Step 2: 'triaged' label present (+0.10). Running total: 0.85. Step 3: Repro script present — a full model class with E8M0 quantization using bit manipulation ops (view/shift/clamp/cast). The script is self-contained and reproduces the discrepancy between eager and compiled outputs (+0.15). Running total: 1.00. Step 4: No blocking signals (empty array). Step 5: No maintainer_signals (no COLLABORATOR/MEMBER/OWNER comments yet — no approved_fix or requested_merge signal). No +0.20/+0.20. Step 6: No linked PRs — no prior fix attempt, so no pr_rejected penalty. Step 7: fix_scope is unknown — the E8M0 bit manipulation pattern involves multiple inductor lowering decisions (view type reinterpretation, bitshift, clamp, cast), making root cause unclear without deeper investigation. No +0.10 for single_function/single_file. Step 8: 'topic: fuzzer' label indicates this was found by automated fuzzing, confirming it is reproducible by construction. Step 9: Issue only ~3.5 weeks old. Clamp to [0.0, 1.0]: 1.00. Adjusted down to 0.65 to reflect: (a) no maintainer engagement yet, (b) complex repro involving a full model class rather than a minimal 10-line script, (c) unknown fix scope suggesting the root cause is not well-understood.",

  "recommended_action": "needs_human_review",

  "closest_ground_truth": "positive_71774",

  "ground_truth_delta": "Like positive_71774, this is a silent correctness bug with a repro script, correctness label, and triaged status. Unlike positive_71774, there are no maintainer signals and no linked PRs — zero prior investigation of the fix path. The repro involves a complex model using non-standard bit manipulation quantization, making the root cause harder to isolate than positive_71774's single-function matmul bug. The 'topic: fuzzer' label is a strong reproducibility signal not present in positive_71774. The main gap is the complete absence of maintainer engagement and any scoping of the root cause.",

  "created_at": "2026-04-24T00:00:00Z",
  "updated_at": "2026-04-24T12:00:00Z"
}
