{
  "finding_id": "pytorch_163574",
  "repo": "pytorch/pytorch",
  "issue_number": 163574,
  "issue_title": "Bfloat16 large numerical discrepancy on Blackwell",
  "issue_url": "https://github.com/pytorch/pytorch/issues/163574",
  "issue_state": "OPEN",
  "issue_created_at": "2025-09-22T22:18:41Z",
  "issue_labels": [
    "module: numerical-stability",
    "module: cuda",
    "triaged",
    "module: bfloat16",
    "module: correctness (silent)"
  ],
  "body_preview": "",
  "initial_classification": "correctness_silent",
  "surface_reasoning": "Priority 1: labeled `module: correctness (silent)` + `module: cuda` + `module: bfloat16`. Title: bfloat16 large numerical discrepancy on Blackwell — hardware-specific bf16 precision bug on a new GPU generation. Domain relevance: Blackwell (GB100/GB200) architecture may have different bf16 rounding behavior; diagnosing requires CUDA kernel expertise and access to Blackwell-specific GPU documentation.",
  "stage": "needs_review",
  "linked_prs": [
    {
      "number": 163537,
      "title": "Large tests failing on bfloat16",
      "url": "https://github.com/pytorch/pytorch/pull/163537",
      "state": "closed",
      "merged": false,
      "merged_at": null,
      "abandoned_reason": "ghstack artifact — PR is part of a stack under #159494. pytorchmergebot attempted merge twice ('Starting merge as part of PR stack under #159494') but the PR closed with mergedAt=null. The PR addresses test tolerance/infrastructure rather than the root cause of the bf16 numerical discrepancy on Blackwell. The underlying numerical issue tracked in #163574 remains open.",
      "reviews_summary": "COLLABORATOR Skylion007 approved on 2025-09-22. COLLABORATOR eqy approved on 2025-09-22. CONTRIBUTOR malfet approved on 2025-09-22. pytorchmergebot attempted merge twice as part of the ghstack stack but the PR closed without merging."
    }
  ],
  "maintainer_signals": [
    {
      "author": "ngimel",
      "role": "COLLABORATOR",
      "signal_type": "scoped_bug",
      "quote": "abs diff of 16 makes me think it's split-k"
    }
  ],
  "blocking_signals": [],
  "fix_scope": "unknown",
  "affected_hardware": ["cuda", "Blackwell"],
  "still_reproducible": "likely",
  "confidence": 0.60,
  "confidence_justification": "Start: 0.50. Step 1: 'module: correctness (silent)' label present → +0.25. Running total: 0.75. Step 2: 'triaged' label present → +0.10. Running total: 0.85. Step 3: Issue body contains detailed ULP failure output with exact indices and values — this is a partial repro signal (test output showing numerical discrepancies, with test reproduction command, but requires a Blackwell GPU to run) → +0.05 (partial repro only, no self-contained runnable script). Running total: 0.90. Step 4: COLLABORATOR ngimel comment 'abs diff of 16 makes me think it's split-k' provides a hypothesis but no actionable fix path for a contributor → no adjustment. Step 5: Linked PR #163537 is a ghstack artifact addressing test tolerances, not the root cause; its close is not a rejection of a bug fix. No approved_fix or requested_merge for the underlying issue → no bonus. Step 6: fix_scope = 'unknown' (COLLABORATOR identified possible split-k behavior in cuBLAS/cublasLt but provided no specific file or function to fix) → no +0.10. Step 7: Blackwell-specific issue requiring specialized hardware access — not easily actionable by community contributors → practical concern but no direct scoring rule. Step 8: Issue less than 2 years old → no +0.05. Step 9: Clamp. The hardware specificity (Blackwell GPU required) and unknown fix_scope significantly reduce actionability for external contributors. Final (clamped): 0.60.",
  "recommended_action": "needs_human_review",
  "closest_ground_truth": "positive_71774",
  "ground_truth_delta": "Like positive_71774, this has the 'module: correctness (silent)' label, triaged status, and a COLLABORATOR scoping comment. Unlike positive_71774, there is no approved fix PR for the root cause (the related PR #163537 only adjusts test tolerances), and the bug is Blackwell-specific requiring specialized GPU hardware unavailable to most contributors. The fix_scope is unknown — ngimel's 'split-k' hypothesis is suggestive but not actionable. This is less actionable than positive_71774 due to hardware accessibility barriers and absence of a concrete fix path.",
  "created_at": "2026-04-24T10:00:00Z",
  "updated_at": "2026-04-24T12:00:00Z"
}
